{
  "name": "scandinavian",
  "version": "0.1.0",
  "extends": "default-tech",
  "description": "Scandinavian hygge — warm linen, sage green, soft clay, Fraunces + Work Sans.",
  "vibe": "Scandinavian — #efe9df linen, sage #9caf88 + clay #c9826b (matches Hygge gallery).",
  "license": "MIT",
  "author": "Timur Isachenko",
  "roles": {
    "bg": "#efe9df",
    "bg2": "#e6ddd1",
    "text": "#2b2926",
    "muted": "#65605c",
    "accent": "#9caf88",
    "accent2": "#c9826b",
    "cardBg": "rgba(43,41,38,0.04)",
    "border": "rgba(43,41,38,0.1)"
  },
  "typography": {
    "headingFont": "'Fraunces', Georgia, serif",
    "bodyFont": "'Work Sans', system-ui, sans-serif",
    "headingWeight": 600,
    "googleFonts": [
      "Fraunces:wght@500;600;700",
      "Work+Sans:wght@400;600"
    ]
  },
  "geometry": {
    "radius": "16px",
    "slideWidth": "1280px"
  }
}
