{
  "name": "botanical-luxe",
  "version": "0.1.0",
  "extends": "default-tech",
  "description": "Botanical luxe \u2014 deep forest green, gold leaf, serif elegance for impact reports.",
  "vibe": "Botanical luxe \u2014 forest #1d3a2f, gold #bfa55a, Cormorant + DM Sans (matches Verdant gallery).",
  "license": "MIT",
  "author": "Timur Isachenko",
  "roles": {
    "bg": "#1d3a2f",
    "bg2": "#162d24",
    "text": "#f3efe4",
    "muted": "#a3c3ad",
    "accent": "#bfa55a",
    "accent2": "#4a7c59",
    "cardBg": "rgba(191,165,90,0.08)",
    "border": "rgba(191,165,90,0.28)"
  },
  "typography": {
    "headingFont": "'Cormorant Garamond', Georgia, serif",
    "bodyFont": "'DM Sans', system-ui, sans-serif",
    "headingWeight": 600,
    "googleFonts": [
      "Cormorant+Garamond:wght@500;600;700",
      "DM+Sans:wght@400;600"
    ]
  },
  "geometry": {
    "radius": "8px",
    "slideWidth": "1280px"
  }
}
