{
  "name": "kinetic-wrapped",
  "version": "0.1.0",
  "extends": "default-tech",
  "description": "Kinetic Wrapped — acid lime on black, Archivo Black, year-in-review energy.",
  "vibe": "Kinetic Wrapped — black + #c8ff00 acid lime, Archivo Black (matches Pulse gallery).",
  "license": "MIT",
  "author": "Timur Isachenko",
  "roles": {
    "bg": "#0a0a0a",
    "bg2": "#0d0d0d",
    "text": "#ffffff",
    "muted": "#9c9c9c",
    "accent": "#c8ff00",
    "accent2": "#ff00cc",
    "cardBg": "rgba(200,255,0,0.08)",
    "border": "rgba(200,255,0,0.4)"
  },
  "typography": {
    "headingFont": "'Archivo Black', system-ui, sans-serif",
    "bodyFont": "'Inter', system-ui, sans-serif",
    "headingWeight": 400,
    "googleFonts": [
      "Archivo+Black",
      "Inter:wght@400;600"
    ]
  },
  "geometry": {
    "radius": "0px",
    "slideWidth": "1280px"
  }
}
