{
  "name": "dark-botanical",
  "version": "1.0.0",
  "extends": "default-tech",
  "description": "Dark Botanical \u2014 Cormorant on near-black with warm pink/gold accents (frontend-slides STYLE_PRESETS).",
  "vibe": "Dark Botanical \u2014 #0f0f0f void, warm #d4a574/#e8b4b8 accents, Cormorant + IBM Plex Sans (frontend-slides Dark Botanical).",
  "license": "MIT",
  "author": "Timur Isachenko",
  "roles": {
    "bg": "#0f0f0f",
    "bg2": "#1a1816",
    "text": "#e8e4df",
    "muted": "#9a9590",
    "accent": "#d4a574",
    "accent2": "#e8b4b8",
    "cardBg": "rgba(232,228,223,0.06)",
    "border": "rgba(232,228,223,0.12)"
  },
  "typography": {
    "headingFont": "'Cormorant', Georgia, serif",
    "bodyFont": "'IBM Plex Sans', system-ui, sans-serif",
    "headingWeight": 600,
    "googleFonts": [
      "Cormorant:ital,wght@0,400;0,600;1,400;1,600",
      "IBM+Plex+Sans:wght@300;400"
    ]
  },
  "geometry": {
    "radius": "0px",
    "slideWidth": "1280px"
  }
}
